{
  "chunk_id": "chunk_product_byd_2024h1_accounts_receivable",
  "company": {
    "company_id": "cn_002594",
    "country_code": "CN",
    "exchange": "SZSE",
    "legal_name": "比亚迪股份有限公司",
    "ticker": "002594"
  },
  "content_role": "untrusted_source",
  "document_id": "doc_product_byd_2024h1",
  "document_type": "interim_report",
  "language": "zh-CN",
  "locator": {
    "char_end": null,
    "char_start": null,
    "page_end": 81,
    "page_start": 81,
    "paragraph_end": null,
    "paragraph_start": null
  },
  "parser_version": "pypdf-6.10.0",
  "published_at": "2024-08-29T23:59:59+08:00",
  "quality_flags": [
    "text_native",
    "table_linearized"
  ],
  "reporting_period": {
    "accounting_standard": "CAS",
    "fiscal_period": "H1",
    "fiscal_year": 2024,
    "period_basis": "ytd",
    "period_end": "2024-06-30",
    "period_start": "2024-01-01",
    "restatement_status": "as_reported",
    "statement_scope": "consolidated"
  },
  "retrieved_at": "2026-09-03T22:42:00+08:00",
  "schema_version": "1.4.0",
  "section": "Financial statement fact: 应收账款",
  "source_uri": "https://static.cninfo.com.cn/finalpage/2024-08-29/1221030552.PDF",
  "text": "应收账款 4  71,814,516   61,866,019",
  "text_hash": "b3f4adabca8b98cdfb25fa7e66e483de0408960cbd9e7aeeb9d3511088c9ac06"
}
