{
  "chunk_id": "chunk_v15_farasis_2024h1_synthetic_financial_summary",
  "company": {
    "company_id": "cn_688567",
    "country_code": "CN",
    "exchange": "SSE",
    "legal_name": "孚能科技（赣州）股份有限公司",
    "ticker": "688567"
  },
  "content_role": "untrusted_source",
  "document_id": "doc_v15_farasis_2024h1",
  "document_type": "interim_report",
  "language": "zh-CN",
  "locator": {
    "char_end": null,
    "char_start": null,
    "page_end": 74,
    "page_start": 68,
    "paragraph_end": null,
    "paragraph_start": null
  },
  "parser_version": "1.1.0",
  "published_at": "2024-08-24T23:59:59+08:00",
  "quality_flags": [
    "table_linearized"
  ],
  "reporting_period": {
    "accounting_standard": "CAS",
    "fiscal_period": "H1",
    "fiscal_year": 2024,
    "period_basis": "ytd",
    "period_end": "2024-06-30",
    "period_start": "2024-01-01",
    "restatement_status": "as_reported",
    "statement_scope": "consolidated"
  },
  "retrieved_at": "2026-09-01T14:00:00+08:00",
  "schema_version": "1.4.0",
  "section": "Synthetic normalized financial summary",
  "source_uri": "https://static.cninfo.com.cn/finalpage/2024-08-24/1220962674.PDF",
  "text": "SYNTHETIC PUBLIC EVIDENCE — normalized factual summary; not verbatim filing text.\naccounts_receivable: 4354023209.67 CNY\ninventory: 2257580276.90 CNY\nrevenue: 6973894596.88 CNY\noperating_cost: 6033458121.25 CNY\nnet_income: -190363136.25 CNY\noperating_cash_flow: -552186771.38 CNY\nUse the official source URI and physical-page locators for source verification.",
  "text_hash": "da30eb7a53153103de49609bcdee9709d91bc4c53dc6bae5bdc52c3331bb5e3c"
}
